{
  "capture_mode": "PASSIVE_READ_ONLY",
  "captured_at_utc": "2026-08-07T14:33:19.7853376Z",
  "checks": {
    "disk_health": "PASS",
    "network_reconnect": "NOT_RUN",
    "reboot": "NOT_RUN",
    "sustained_cpu_gpu_load": "NOT_RUN"
  },
  "exit_gate": {
    "blocking_reasons": [
      "BATTERY_CONSERVATION_NOT_VERIFIED_ENABLED",
      "BITLOCKER_PROTECTION_NOT_ON",
      "NETWORK_RECONNECT_TEST_NOT_PASS",
      "REBOOT_TEST_NOT_PASS",
      "RECOVERY_KEY_CUSTODY_CONFIRMATION_REQUIRED",
      "RESTART_AFTER_POWER_LOSS_NOT_VERIFIED_ENABLED",
      "SUSTAINED_CPU_GPU_LOAD_TEST_NOT_PASS",
      "SYSTEM_VOLUME_NOT_FULLY_ENCRYPTED"
    ],
    "status": "BLOCKED"
  },
  "hardware": {
    "cpu": {
      "logical_processors": 8,
      "model": "Intel(R) Core(TM) i5-9300H CPU @ 2.40GHz",
      "physical_cores": 4
    },
    "gpu": {
      "driver_version": "591.74",
      "idle_temperature_c": 56,
      "model": "NVIDIA GeForce RTX 2060",
      "present": true,
      "telemetry_source": "NVIDIA_SMI",
      "vendor": "NVIDIA",
      "vram_mib": 6144
    },
    "memory": {
      "total_gib": 15.87
    },
    "storage": {
      "physical_disks": [
        {
          "health_status": "Healthy",
          "media_type": "SSD",
          "operational_status": "OK",
          "size_gib": 476.94
        }
      ],
      "system_volume": {
        "capacity_gib": 475.69,
        "free_gib": 177.33,
        "free_percent": 37.28,
        "health_status": "Healthy"
      }
    }
  },
  "network": {
    "public_exposure_assessment": "BASELINE_FIREWALL_ONLY_NO_V10_RUNTIME",
    "wired_connected": true,
    "wired_link_speed_mbps": 1000
  },
  "node_role": "OWNER_PERSONAL_NODE",
  "os": {
    "architecture": "64-bit",
    "build": "26200",
    "last_boot_utc": "2026-08-07T11:25:35.5000000Z",
    "product_name": "Майкрософт Windows 11 Домашняя",
    "version": "10.0.26200"
  },
  "power": {
    "ac_online": true,
    "active_power_scheme": "Razer Cortex Power Plan",
    "battery_conservation": "UNKNOWN_REQUIRES_OWNER_CHECK",
    "battery_present": true,
    "restart_after_power_loss": "UNKNOWN_REQUIRES_FIRMWARE_CHECK"
  },
  "privacy": {
    "mac_or_ip_collected": false,
    "recovery_key_material_collected": false,
    "secret_values_collected": false,
    "serial_numbers_collected": false,
    "usernames_or_hostnames_collected": false
  },
  "schema_version": "1",
  "security": {
    "firewall": {
      "profiles": [
        {
          "default_inbound_action": "Block",
          "default_outbound_action": "Allow",
          "enabled": true,
          "name": "Domain"
        },
        {
          "default_inbound_action": "Block",
          "default_outbound_action": "Allow",
          "enabled": true,
          "name": "Private"
        },
        {
          "default_inbound_action": "Block",
          "default_outbound_action": "Allow",
          "enabled": true,
          "name": "Public"
        }
      ],
      "wildcard_tcp_listener_count": 27
    },
    "full_disk_encryption": {
      "encryption_method": "None",
      "encryption_percentage": 0,
      "protection_status": "OFF",
      "provider": "BITLOCKER",
      "recovery_key_custody_status": "OWNER_CONFIRMATION_REQUIRED",
      "volume_status": "FullyDecrypted"
    },
    "private_at_rest": {
      "acl_state": "WP6_NOT_YET_CONFIGURED",
      "classification": "BROKER_SECRETS_PRIVATE_DB_CORTEX_HISTORY_PRIVATE"
    }
  },
  "thermal": {
    "acpi_zone_max_idle_c": null,
    "gpu_idle_c": 56,
    "observation": "SENSORS_PARTIAL"
  },
  "thresholds_ref": "infrastructure/windows/wp5_node_thresholds.json",
  "time": {
    "measured_against": "time.windows.com",
    "offset_ms": -73.049,
    "sensitive_operation_gate": "PASS",
    "service_status": "RUNNING",
    "source_class": "OTHER",
    "utc_policy": "CANONICAL_EVENT_TIMESTAMPS_UTC"
  }
}
